{
  "compatibility_catalog": "scenery.compatibility-core",
  "content_digest": "sha256:2710ba742c8b51c5c5df25444c24515cf7eea2a87070a8a7910a3f3509e89830",
  "contract_revision": "sha256:04dc6527b5ba3bd0d680186b14c52722c1c8112828b8b39596bca90a1552d8f7",
  "covered_bindings": [
    "inbox/binding/receive_http",
    "inbox/binding/status_http"
  ],
  "covered_gateways": [
    "http_gateway.public_api"
  ],
  "covered_operations": [
    "inbox/operation/process",
    "inbox/operation/status"
  ],
  "covered_types": [
    "inbox/record/event",
    "inbox/record/lookup",
    "inbox/record/processed_event"
  ],
  "files": [
    "client.ts",
    "index.ts",
    "metadata.ts",
    "runtime.ts",
    "types.ts"
  ],
  "generator": "scenery.generate.typescript",
  "http_surface_revisions": {
    "app/http_gateway/public_api": "sha256:bd6545c4b595f495064663a04d8fe04e876b0fb185b8c8bcc725d99750860085"
  },
  "javascript_target": null,
  "kind": "scenery.typescript-client-generated",
  "openapi_revisions": {
    "app/http_gateway/public_api": "sha256:0ec73e5095dcf309c09674fc6633928085c937fd787ba14693e91fd075b75264"
  },
  "package": "@example/webhook-client",
  "producer": {
    "version": "v0.3.7-0.20261026175806-0c1f7fcdc229+dirty",
    "commit": "0c1f7fcdc2293d4907ab5720fc5ac4a744eb32b4",
    "built_at": "2026-10-26T17:58:06Z",
    "toolchain": {
      "go_version": "go1.27.0"
    }
  },
  "schema_revision": "sha256:02994dd4a50ed41bdbeab0ba09020de6d9b8366353b2d44bd7022981ca17e801",
  "spec_revision": "sha256:4b8e5399d0d5e8a6706f184878455d65ad897e42d01ce0c287e1ddcd5d7c29b4",
  "target": "app/typescript_client/public_api",
  "typescript_client_revision": "sha256:c4d467174cef837b4725316acf8911319bbdde55179dff24d813964af83aa24d",
  "typescript_version": null,
  "ui_catalog_roots": []
}
