{
  "compatibility_catalog": "scenery.compatibility-core",
  "content_digest": "sha256:e8497d20fe0006165b0ff1e086fc12a0cfc73f480122b4e78b69b0c27bf0eef3",
  "contract_revision": "sha256:b9ad699e486bf7717d14e8586c5675271be93e061bac610cbf6a8524d067cff2",
  "covered_bindings": [],
  "covered_gateways": [
    "http_gateway.public_api"
  ],
  "covered_operations": [],
  "covered_types": [],
  "files": [
    "assistant.ts",
    "client.ts",
    "index.ts",
    "metadata.ts",
    "runtime.ts",
    "types.ts"
  ],
  "generator": "scenery.generate.typescript",
  "http_surface_revisions": {
    "app/http_gateway/public_api": "sha256:e9a3dead4cf0c7e0520dfaa78ed06d6886b18c0c1cc926c1f957e02d92b3fe89"
  },
  "javascript_target": null,
  "kind": "scenery.typescript-client-generated",
  "openapi_revisions": {
    "app/http_gateway/public_api": "sha256:8fd618c53da5a791eb1765b6559071a65617b155931f3285a1a2187bf5740cc6"
  },
  "package": "@example/assistant-client",
  "producer": {
    "version": "v0.3.7-0.20261026170913-12ef9c0e06bd+dirty",
    "commit": "12ef9c0e06bd4619552c0228cf3c47c062b84978",
    "built_at": "2026-10-26T17:09:13Z",
    "toolchain": {
      "go_version": "go1.27.0"
    }
  },
  "schema_revision": "sha256:02994dd4a50ed41bdbeab0ba09020de6d9b8366353b2d44bd7022981ca17e801",
  "spec_revision": "sha256:4b8e5399d0d5e8a6706f184878455d65ad897e42d01ce0c287e1ddcd5d7c29b4",
  "target": "app/typescript_client/public_api",
  "typescript_client_revision": "sha256:86af9a0116997da07954c4dab16ca3a208d415eec1ab92bfda409f7cae4936e8",
  "typescript_version": null,
  "ui_catalog_roots": []
}
