{
  "compatibility_catalog": "scenery.compatibility-core",
  "content_digest": "sha256:a9bfba6e1473556f4b8b21cde0db4f479e90ffd2481c16b734fc951e83b7e21a",
  "contract_revision": "sha256:d17d303d42859564e1b1e17e4415fa563f85c6ddb73d6eb4f5b293fcbfc01689",
  "covered_bindings": [
    "house/binding/list_scene_events_http",
    "house/binding/process_scene_http"
  ],
  "covered_gateways": [
    "http_gateway.public_api"
  ],
  "covered_operations": [
    "house/operation/list_scene_events",
    "house/operation/process_scene"
  ],
  "covered_types": [
    "house/record/process_scene_input",
    "house/record/process_scene_result",
    "house/record/scene_event",
    "house/record/scene_events_input",
    "house/record/scene_events_result"
  ],
  "files": [
    "client.ts",
    "dev-runtime.ts",
    "index.ts",
    "metadata.ts",
    "runtime.ts",
    "types.ts"
  ],
  "generator": "scenery.generate.typescript",
  "http_surface_revisions": {
    "app/http_gateway/public_api": "sha256:2a82ba7bfb946f53b1db01ab55d76f5679c8e9fb6937cb51899bb0becfe1c3ea"
  },
  "javascript_target": null,
  "kind": "scenery.typescript-client-generated",
  "openapi_revisions": {
    "app/http_gateway/public_api": "sha256:db9dd85ff0a23d97c1737c0507ac7483e0c4e6fd9653897c7e58636ed2bc2a88"
  },
  "package": "@example/scenery-client",
  "producer": {
    "version": "v0.3.7-0.20261019133150-9f23218e161d+dirty",
    "commit": "9f23218e161dddf8a4f31c027a953ffdefa992c1",
    "built_at": "2026-10-19T13:31:50Z",
    "toolchain": {
      "go_version": "go1.27.0"
    }
  },
  "schema_revision": "sha256:02994dd4a50ed41bdbeab0ba09020de6d9b8366353b2d44bd7022981ca17e801",
  "spec_revision": "sha256:4b8e5399d0d5e8a6706f184878455d65ad897e42d01ce0c287e1ddcd5d7c29b4",
  "target": "app/typescript_client/public_api",
  "typescript_client_revision": "sha256:fa17453e12138951b920ae25df9cf38df77a3c553886d81fd1a274b7dc7f8ca4",
  "typescript_version": null,
  "ui_catalog_roots": []
}
